{
  "$schema": "https://json-schema.org/draft/2020-12/schema",
  "$id": "https://uffda.ag/sandbox/tile.schema.json",
  "title": "UFFDA Sandbox Tile",
  "description": "Schema for every tile.json in the uffda-ag/sandbox repo. See CONTRIBUTING.md for field-level guidance.",
  "type": "object",
  "required": [
    "name",
    "slug",
    "type",
    "status",
    "tagline",
    "description",
    "icon",
    "tags",
    "author",
    "license",
    "createdAt"
  ],
  "additionalProperties": false,
  "properties": {
    "name": {
      "type": "string",
      "minLength": 2,
      "maxLength": 64
    },
    "slug": {
      "type": "string",
      "pattern": "^[a-z0-9]+(-[a-z0-9]+)*$",
      "minLength": 2,
      "maxLength": 48
    },
    "type": {
      "type": "string",
      "enum": [
        "iframe",
        "react",
        "link"
      ]
    },
    "status": {
      "type": "string",
      "description": "Content readiness. coming-soon = idea, not started. in-dev = actively being built right now (never a placeholder). live = working + shown. retired = was live, now benched; kept for history, never `featured`, never re-marked in-dev. See structure.md 'Tile hygiene rules'.",
      "enum": [
        "coming-soon",
        "in-dev",
        "live",
        "retired"
      ]
    },
    "tagline": {
      "type": "string",
      "minLength": 8,
      "maxLength": 80
    },
    "description": {
      "type": "string",
      "minLength": 16,
      "maxLength": 600
    },
    "icon": {
      "type": "string",
      "enum": [
        "play",
        "globe",
        "doc",
        "build-it"
      ]
    },
    "tags": {
      "type": "array",
      "items": {
        "type": "string",
        "pattern": "^[a-z0-9]+(-[a-z0-9]+)*$",
        "maxLength": 24
      },
      "minItems": 1,
      "maxItems": 6,
      "uniqueItems": true
    },
    "author": {
      "type": "object",
      "required": [
        "name"
      ],
      "additionalProperties": false,
      "properties": {
        "name": {
          "type": "string",
          "minLength": 1,
          "maxLength": 80
        },
        "github": {
          "type": "string",
          "pattern": "^[A-Za-z0-9-]+$"
        },
        "site": {
          "type": "string",
          "format": "uri"
        }
      },
      "anyOf": [
        {
          "required": [
            "github"
          ]
        },
        {
          "required": [
            "site"
          ]
        }
      ]
    },
    "license": {
      "type": "string",
      "description": "SPDX license identifier, OR the literal 'NOASSERTION' if license is uncertain (only allowed on iframe + link tiles, not native React). Common values: MIT, Apache-2.0, BSD-3-Clause, CC-BY-4.0, CC-BY-SA-4.0, CC0-1.0, NOASSERTION."
    },
    "featured": {
      "type": "boolean",
      "default": false,
      "description": "Set by UFFDA maintainers, not contributors. Boosts the tile in the gallery's default sort."
    },
    "createdAt": {
      "type": "string",
      "pattern": "^\\d{4}-\\d{2}-\\d{2}$"
    },
    "entry": {
      "type": "string",
      "description": "Required for iframe (defaults to index.html) and react (defaults to Tile.tsx). Path relative to the tile folder."
    },
    "url": {
      "type": "string",
      "format": "uri",
      "description": "Required for link tiles. The destination URL."
    },
    "licenseNote": {
      "type": "string",
      "maxLength": 280,
      "description": "Optional best-effort note about the license. Encouraged when license is NOASSERTION ('I think this was MIT but lost the original repo,' 'parts of this are from Stack Overflow snippets,' etc.). Renders alongside the license badge for transparency."
    }
  },
  "allOf": [
    {
      "if": {
        "properties": {
          "type": {
            "const": "link"
          }
        }
      },
      "then": {
        "required": [
          "url"
        ]
      }
    },
    {
      "if": {
        "properties": {
          "type": {
            "enum": [
              "iframe",
              "react"
            ]
          }
        }
      },
      "then": {
        "not": {
          "required": [
            "url"
          ]
        }
      }
    },
    {
      "if": {
        "properties": {
          "type": {
            "const": "react"
          },
          "license": {
            "const": "NOASSERTION"
          }
        },
        "required": [
          "type",
          "license"
        ]
      },
      "then": {
        "properties": {
          "license": {
            "not": {
              "const": "NOASSERTION"
            }
          }
        }
      }
    }
  ]
}