{
  "name": "CropSight-US validated fields",
  "slug": "cropsight-us",
  "type": "iframe",
  "status": "live",
  "tagline": "Sparse research-grade reference, CONUS 2013-2023. CC-BY-4.0.",
  "description": "124,419 validated field polygons across CONUS, 2013-2023. Crop identity from Google Street View (97.2% accuracy); boundary delineation from Sentinel-2 (98.0% F1). 17 crop types, 294 Agricultural Statistics Districts. Ground-truth-quality where present, NOT a wall-to-wall paint layer — use as a reference to spot-check against, not as a coverage source. UIUC research; ESSD 2026 paper (Copernicus); Zenodo DOI 10.5281/zenodo.15702414.",
  "icon": "globe",
  "tags": ["boundary", "reference", "conus", "sentinel-2", "cropsight", "essd"],
  "author": {
    "name": "UIUC / ESSD 2026",
    "site": "https://essd.copernicus.org/articles/18/3069/2026/"
  },
  "license": "CC-BY-4.0",
  "licenseNote": "Attribution: UIUC research team, ESSD 2026 paper, Zenodo record 19501943 (v1.0.1).",
  "featured": false,
  "createdAt": "2026-05-13",
  "entry": "index.html"
}
